date,content,posted,posted_date
2026-01-16,ان حسن ظني بربي يجعل الامور دائما تسير لمصلحتي وهذا يجعلني متفائلا باستمرار فلنحسن الظن بالله,True,
2026-01-17,كن لطيفا وحنونا على نفسك بأفكارك وردات فعلك وسلوكك ، راقبها جيدا وركز على كل ما هو إيجابي وتجاهل السلبي منها لأن لنفسك عليك حق.,True,2026-01-17T08:34:48.502458
2026-01-18,توكيده صباحية: كل شيء يعمل لصالحي أنا بأمان ، أنا أستبدل الخوف بالتفاؤل والحب الحقيقي. قلها بتأن وأنت تستشعرها,True,2026-01-18T08:35:01.025003
2026-01-19,خمس عبارات يحب الزوج سمعها من زوجته: أنت وسيم، بوجودك بحياتي أنا أكثر سعادة، أنا أحب فيك، أنا أثق بك، انا فخورة بك,True,2026-01-19T10:50:47.654267
2026-01-20,دعاء قله بقلبك وبيقين وأنت تستشعره يغير أحوالك: اللهم يا مغير الأحوال غير حالي لأفضل حال,True,2026-01-20T08:42:08.344858
2026-01-21,حافظ على مشاعرك، هي ليست حاوية كلٌّ يرمي فيها ما يشاء. فالكلام الذي يقلّل من شأنك لا يلزمك، ومشاكل الآخرين هي ليست مشاكلك,True,
